{
 "app": "GHDL coverage output file",
 "version": "1.0.0",
 "testcase": "unknown",
 "timestamp": "20261008221243.691",
 "outputs": [
  {
   "file": "tb/Counter_tb.vhdl",
   "dir": ".",
   "sha1": "f758ffb261a1823d43a87787fb3df0b86eb9a636",
   "mode": "stmt",
   "max-line": 66,
   "result": {
    "26": 1,
    "42": 1,
    "43": 1,
    "44": 1,
    "46": 0,
    "47": 0,
    "49": 1,
    "51": 1,
    "52": 1,
    "56": 1,
    "58": 1,
    "59": 1,
    "60": 1,
    "65": 1,
    "66": 0
   }
  },
  {
   "file": "src/Utilities/Functions.vhdl",
   "dir": ".",
   "sha1": "25d6a81f13f918257d0554c76ec1e84c022a932a",
   "mode": "stmt",
   "max-line": 26,
   "result": {
    "15": 1,
    "16": 1,
    "18": 1,
    "23": 1,
    "24": 0,
    "26": 1
   }
  },
  {
   "file": "src/Counter.vhdl",
   "dir": ".",
   "sha1": "1a6afa99b014932646ce6591101aa1ac3695349a",
   "mode": "stmt",
   "max-line": 35,
   "result": {
    "25": 1,
    "26": 1,
    "27": 1,
    "29": 1,
    "34": 1,
    "35": 1
   }
  }
 ]
}
